{
  "version": "1",
  "pipeline": "machine_learning",
  "source": "inertial",
  "process": "train",
  "model": "./path/to/model.ext",
  "input": {
    "file": {
      "type": "raw",
      "filename": "./path/to/file.ext"
    }
  },
  "windowing": {
    "enable": true,
    "parameters": {
      "length": 60,
      "function": {
        "label": "none",
        "container": "core-window-functions"
      },
      "overlap": 0
    }
  },
  "features": [
    {
      "label": "average",
      "container": "core-features"
    },
    {
      "label": "std_dev",
      "container": "core-features"
    }
  ],
  "algorithm": {
    "name": "random_forest",
    "container": "core-py-sk",
    "parameters": {
      "example": "parameter"
    }
  }
}
